{
  "nonce": "q3Jx9kLm2Pz8Rt4Vw6Yb0A",
  "issuedAt": "2026-10-16T09:14:07.000Z",
  "edgeId": "acme-eu-1",
  "payload": {
    "frame": {
      "type": "request",
      "id": "1d2c3b4a-5f6e-4d7c-8b9a-0f1e2d3c4b5a",
      "sessionId": "0e9d8c7b-6a5f-4e3d-8c2b-1a0f9e8d7c6b"
    },
    "body": {
      "op": "txn.search",
      "params": {
        "from": "2026-10-01T00:00:00Z",
        "to": "2026-10-16T23:59:59Z",
        "merchantId": "mrc_00421",
        "decisions": [
          "ALERT",
          "HOLD",
          "BLOCK"
        ]
      },
      "deadlineMs": 8000,
      "page": {
        "limit": 50
      },
      "actor": {
        "kind": "PSP_USER",
        "userId": "u-4512",
        "role": "COMPLIANCE_OFFICER",
        "pspId": 12,
        "purpose": "CASE_INVESTIGATION",
        "caseId": "CASE-2026-0412"
      },
      "auditId": "7c3e1a9b-2d4f-4b6a-8e0c-5f7a9b1d3e2c"
    }
  }
}
